{
  "target": {
    "repo": "github.com/OpenCppCoverage/OpenCppCoverage",
    "commit": "3e518697ea761935574af486bacd5fcc1aeab363"
  },
  "analysisRound": 1,
  "reviewRound": 2,
  "maxReviewRounds": 3,
  "status": "passed",
  "note": "Accepted at head 81376ba with run 32357865925 and with independent runtime evidence produced by this session in run 32361171722. Every hard gate has measured evidence and the cross-artifact gate accepts the run only because analysis, plan, build, runtime, purity and review documents are all present and coherent. The analysis and plan were reconstructed by the coordinator after the migration, from baseline source at 3e518697, and that ordering is disclosed in plan.json openQuestions rather than concealed. Successor heads f1a5c4b and da333df are recorded as pending successors and are not accepted.",
  "history": [
    {
      "stage": "setup",
      "round": 0,
      "agent": "winport",
      "result": "Recorded the immutable upstream baseline and an honest pending handoff. No implementation commit, ARM64 build, tests, runtime execution, purity scan, package, checksum, or release artifact was reported.",
      "timestamp": "2026-08-19T15:48:43.000+03:00"
    },
    {
      "stage": "migration",
      "round": 0,
      "agent": "port-migration",
      "result": "Sibling reported more than 54 uncommitted source, build, CI, test, dependency, and packaging files changed for ARM64.",
      "detail": "Reported areas include ARM64 configurations, pinned vcpkg and ctemplate overlay work, debugger context and PE support, tests, windows-11-arm CI, and packaging scripts. No immutable head commit or source-change hash exists yet.",
      "timestamp": "2026-08-19T20:52:16.483+03:00"
    },
    {
      "stage": "gate",
      "round": 0,
      "agent": "port-migration",
      "check": "Pinned x64 dependency restore and x64 Debug regression compilation",
      "result": "Dependency restore reported exit 0; x64 Debug compilation remains failed.",
      "detail": "Three compilation attempts exposed modern-toolchain compatibility issues. Remaining reported failures involve protobuf 6 namespace/warnings and Boost 1.91 optional test formatting. Raw logs and binlogs remain in the sibling session and have not been copied or accepted as immutable WinPort evidence.",
      "timestamp": "2026-08-19T20:52:16.483+03:00"
    },
    {
      "stage": "migration",
      "round": 0,
      "agent": "port-migration",
      "result": "Retained immutable source handoff at commit 9d9ccdc7e6760c8375db92157d6d556ec1bd88d0.",
      "detail": "Copied and independently rehashed the format patch, source ZIP, and 79-path rename-aware manifest. The sibling worktree was reported clean and the patch includes the required Copilot trailer. The source has not been published, so no immutable public URL exists yet.",
      "timestamp": "2026-08-19T22:14:29.107+03:00"
    },
    {
      "stage": "gate",
      "round": 0,
      "agent": "port-review",
      "check": "x86 and x64 compatibility builds, tests, PE output scans, and x64 package audit",
      "result": "pass",
      "detail": "Retained successful x86 and x64 restore/build/test logs. Reported totals are 214 x86 tests with 37/37 x86 output PEs and 215 x64 tests with 37/37 x64 output PEs. x64 Debug and Release builds reported zero warnings/errors. The x64 package staging and re-expanded scans reported 35/35 x64 PEs. Explicit x86 test exclusions remain documented in handoff.json.",
      "timestamp": "2026-08-19T22:14:29.107+03:00"
    },
    {
      "stage": "gate",
      "round": 0,
      "agent": "port-review",
      "check": "ARM64 dependency restore, build, native runtime, purity, and package evidence",
      "result": "fail: ARM64 restore and build did not reach compilation; later gates not run",
      "detail": "The measured X64 runner has no ARM64 compiler tools. ARM64 vcpkg restore and MSBuild exited 1. windows-11-arm CI is configured but has not run. No native execution, E2E, staging/re-expanded ARM64 PE scan, package, checksum, workflow URL, release, or stable download exists.",
      "timestamp": "2026-08-19T22:14:29.107+03:00"
    },
    {
      "stage": "gate",
      "round": 0,
      "agent": "port-review",
      "check": "Private immutable source publication",
      "result": "pass",
      "detail": "Verified t-lsingoei_microsoft/OpenCppCoverage-ARM64 PR #1 is open against master and its head is 9d9ccdc7e6760c8375db92157d6d556ec1bd88d0 with the expected tree. Hosted runners are enterprise-disabled, so source publication did not execute native ARM64 gates.",
      "timestamp": "2026-08-19T22:25:25.334+03:00"
    },
    {
      "stage": "gate",
      "round": 1,
      "agent": "port-review",
      "check": "Native windows-11-arm compiler identity and ARM64 compilation",
      "result": "fail: dependency restore and project compilation selected different MSVC toolsets",
      "detail": "Coordinator reported vcpkg resolving MSVC 14.44.35207 while project compilation resolved legacy MSVC 14.29.30133 (v142) with Windows SDK 10.0.26100.0. ARM64 compilation failed in winnt.h with C3861 for _CountOneBits64. No retained log has been ingested yet, so this remains a reported failure rather than accepted evidence.",
      "timestamp": "2026-08-20T08:59:41.369+03:00"
    },
    {
      "stage": "routing",
      "round": 1,
      "agent": "winport",
      "result": "REVISE source/workflow and harden every agent gate",
      "detail": "The OpenCppCoverage session owns the repair. WinPort now requires coherent vcpkg/MSBuild VCToolsVersion, cl/link roots, SDK identity, clean LIB/INCLUDE, complete per-project ARM64 graph preflight, and deterministic end-to-end acceptance evidence.",
      "timestamp": "2026-08-20T08:59:41.369+03:00"
    },
    {
      "stage": "gate",
      "round": 1,
      "agent": "port-review",
      "check": "Native ARM64 suite results behind workflow run 32303203988",
      "result": "fail: workflow concluded success while CppCoverageTest had two failures",
      "detail": "Downloaded artifacts show 114/116 CppCoverageTest cases passed. CodeCoverageRunnerTest.RunThread and DebugInformationEnumeratorTest.Enumerate failed. The workflow used continue-on-error and its full-sweep summary collected failures without exiting nonzero. TestCppCli was also not selected in Debug|ARM64. Build and PE classification succeeded with v143, but the app is not accepted as working.",
      "timestamp": "2026-08-20T08:59:41.369+03:00"
    },
    {
      "stage": "gate",
      "round": 2,
      "agent": "port-review",
      "check": "Native ARM64 build, tests, end-to-end coverage, and host toolchain identity at head 81376ba",
      "result": "pass",
      "detail": "Downloaded the Native Windows ARM64 job log of run 32357865925 directly from the API. MSBuild resolved to Bin\\\\arm64\\\\MSBuild.exe 17.14.51.32402 with VCToolArchitecture=NativeARM64; Assert-BuildToolchain confirmed every cl and link invocation came from HostArm64\\\\arm64 toolset 14.44.35207 in Debug and Release with zero HostX86 invocations. Debug and Release each ran 215 tests over six suites with every suite exiting 0 and Ran equal to Passed. The end-to-end oracle reported unreachable line 36 as not executed from the build output and again from the expanded package. The source encoding gate passed over 286 files.",
      "timestamp": "2026-08-20T11:12:00.000+03:00"
    },
    {
      "stage": "gate",
      "round": 2,
      "agent": "port-review",
      "check": "TestCppCli exclusion is explicit rather than silent",
      "result": "pass",
      "detail": "MSBuild reports that the project TestCppCli is not selected for building in solution configuration Debug|ARM64 and Release|ARM64 because C++/CLI has no ARM64 target. That is an informational line that vanishes unless recorded, so it is now written into handoff.json as an explicit unsupported exclusion. It explains why ARM64 reports 116 CppCoverageTest cases that are not the same 116 x64 reports: ARM64 drops CppCliTest.ManagedUnManagedModule and gains BreakPointTest.RejectsUnalignedArm64Address, while Win32 reports 115.",
      "timestamp": "2026-08-20T11:12:00.000+03:00"
    },
    {
      "stage": "gate",
      "round": 2,
      "agent": "winport",
      "check": "Independent execution of the published artifact on native ARM64 hardware",
      "result": "pass",
      "detail": "This session created branch winport/independent-verification in the port repository and ran a workflow it authored, which never builds the product. It downloaded the published asset, confirmed SHA-256 83f0e1c1..., expanded 155 files, confirmed Binaries\\\\Plugins\\\\Exporter, read the PE machine of all 34 shipped images and found every one 0xAA64, compiled a fixture with the native HostArm64 toolchain, and executed the shipped OpenCppCoverage.exe against it. Exit code 0, the called line reports 1 hit, the never-called line reports 0 hits, ProcessArchitecture=Arm64. Run 32361171722.",
      "timestamp": "2026-08-20T11:12:00.000+03:00"
    },
    {
      "stage": "toolchain",
      "round": 2,
      "agent": "winport",
      "check": "winport-scan correctness on real Arm64X binaries",
      "result": "fail then fixed",
      "detail": "The purity scanner rejected the correct package with eight malformed-metadata violations on the Arm64X CRT modules. The defect was the scanner requiring each Arm64X code-map range to fit inside a single section SizeOfRawData, while a genuine x64 range spans .text into .hexpthk across a SectionAlignment gap. Fixed to accept contiguous multi-section coverage with extents rounded to SectionAlignment, still rejecting ranges past the last section, with a regression test proven to fail against the previous implementation. Recorded as a durable lesson in port-packaging.",
      "timestamp": "2026-08-20T11:12:00.000+03:00"
    },
    {
      "stage": "routing",
      "round": 2,
      "agent": "winport",
      "result": "PASS",